id,Date,User,Tweet,Media,Likes,Retweets,Comments
0,2022-04-21 22:54:00+00:00,JoeBiden,"Our unity at home and our unity with allies, partners, and the Ukrainian people is sending an unmistakable message to Putin: He will never succeed in dominating and occupying all of Ukraine. That will not happen.",,11413,1663,1557
1,2022-04-02 00:49:00+00:00,JoeBiden,"Putin’s invasion of Ukraine has driven up gas prices and food prices all over the world. 

To help deal with that, yesterday I authorized the release of 1 million barrels per day for the next six months from our Strategic Petroleum Reserve.",,33727,4426,7156
2,2022-03-28 22:54:00+00:00,JoeBiden,"A dictator bent on rebuilding an empire will never erase a people's love for liberty. 

Brutality will never grind down the will to be free. Ukraine will never be a victory for Russia.",,34952,5051,2888
3,2022-03-27 15:35:01+00:00,JoeBiden,My message to the people of Ukraine: We stand with you. Period.,,129578,12598,15042
4,2022-03-25 15:25:16+00:00,JoeBiden,The United States is prepared to commit more than $1 billion in humanitarian assistance to help get relief to millions of Ukrainians affected by the war in Ukraine. https://t.co/c6AeFn8QDn,https://pbs.twimg.com/media/FOtJkl2WQAEQJh5.jpg,8500,1277,1809
5,2022-03-25 01:02:00+00:00,JoeBiden,"NATO has never been more united than it is today. 

Putin is getting exactly the opposite of what he intended to have as a consequence of going into Ukraine.",,48321,5363,4484
6,2022-03-16 14:18:00+00:00,JoeBiden,"The Bipartisan Government Funding Bill includes $13.6B to address Russia's invasion of Ukraine and the impact on surrounding countries.

Putin's aggression against Ukraine has united people across America, united our two parties in Congress, and united the freedom-loving world.",,13843,2045,3307
7,2022-03-14 16:47:01+00:00,JoeBiden,"The American people are united, the world is united, and we stand with the people of Ukraine. 

We will not let autocrats and would-be emperors dictate the direction of the world.",,45510,5737,6539
8,2022-03-09 16:08:01+00:00,JoeBiden,"We're going to continue to support the brave Ukrainian people as they fight for their country.

I call on Congress to pass the $12 billion Ukraine assistance package.",,48724,5341,7012
9,2023-02-07 16:15:00+00:00,POTUS,"Since this, we’ve stood shoulder-to-shoulder with the world in our support for Ukraine, keeping the flame of liberty burning as brightly as we can.",,5488,1024,1427
10,2023-01-25 22:27:09+00:00,POTUS,"Today, I announced that the United States will send 31 Abrams tanks to Ukraine – evidence of our enduring and unflagging commitment to Ukraine and our confidence in the skill of Ukrainian forces.
 
As I told President Zelenskyy, we're with Ukraine for as long as it takes. https://t.co/OvG3Yh55kx",https://pbs.twimg.com/media/FnWfbt6XwAA5G03?format=jpg&name=large,32526,4595,14227
11,2023-01-25 17:01:13+00:00,POTUS,Tune in as I deliver remarks on our continued support for Ukraine. https://t.co/kE6LoH14qa,,13049,2041,4502
12,2023-01-18 23:42:12+00:00,POTUS,"Jill and I send our deepest condolences to the families of all those killed in the tragic helicopter crash in Ukraine this morning – including Minister of Internal Affairs Monastyrskyy, a reformer and patriot.

We grieve with all those who are mourning this heartbreaking tragedy.",,15265,2132,2442
13,2022-12-29 23:18:57+00:00,POTUS,"Today, I signed the bipartisan omnibus bill, ending a year of historic progress.
 
It'll invest in medical research, safety, veteran health care, disaster recovery, VAWA funding – and gets crucial assistance to Ukraine.
 
Looking forward to more in 2023. https://t.co/KTI1R9qMij",https://pbs.twimg.com/media/FlLoXM0WIAY1tzZ?format=jpg&name=large,21579,3232,6271
14,2022-12-23 20:30:00+00:00,POTUS,"The average gas price is now 44 cents below levels when Russia invaded Ukraine.
 
All the increases since the beginning of Russia’s attack have been wiped out.",,24181,3111,8049
15,2022-12-23 17:17:28+00:00,POTUS,"Ukraine and the Ukrainian people don’t just inspire us – they inspire the world. 

It was an honor to host President Zelenskyy at the White House. https://t.co/lzxd40Ervv",https://pbs.twimg.com/media/Fkrdg1vUAAAtwKR.jpg,46715,6962,6167
16,2022-12-22 03:51:34+00:00,POTUS,"Tonight, the fourth night of Hanukkah, we honor the timeless miracle of a small band of warriors fighting for their values against a much larger foe.

That story of resilience reminds me of Ukraine. Even in the darkest days of the year – light will always prevail. https://t.co/4Xqavk1zMA",https://pbs.twimg.com/media/FkjaAaXWYAAz397.jpg,26995,3894,3218
17,2022-12-22 02:30:02+00:00,POTUS,"What President Zelenskyy and the people of Ukraine have achieved matters for the entire world. Together, the United States and Ukraine will keep the flame of liberty burning bright.
 
That light – again – will prevail over darkness. https://t.co/sxktF6bmV7",https://pbs.twimg.com/media/FkjHYKgXEAI_Y9g?format=jpg&name=large,33209,3878,3597
18,2022-12-22 01:50:00+00:00,POTUS,"Today marks 300 days since Putin launched an assault on the free people of Ukraine.
 
Today also marks 300 days of the Ukrainian people showing Russia – and the world – their iron backbone, their love of country, and their unbreakable determination to choose their own path.",,42889,5770,4126
19,2022-12-22 01:11:06+00:00,POTUS,"I had the honor of sitting down with President Zelenskyy of Ukraine.

We've been in communication throughout the war, but it was meaningful to speak in person. I told President Zelenskyy the United States is committed to supporting the Ukrainian people for as long as it takes. https://t.co/l5HwdXmaBW",https://pbs.twimg.com/media/Fki1UIDWIAE5xkD?format=jpg&name=large,79561,7152,5090
20,2022-12-21 23:28:12+00:00,POTUS,"In Ukraine's fight against Russia's unprovoked, unjustified war, I’m proud to say they have not stood alone.
 
And on my watch, they never will. https://t.co/2RV8dyXHxr",https://pbs.twimg.com/media/Fkid72FVQAAthFJ.jpg,135531,13337,21422
21,2022-12-21 22:27:04+00:00,POTUS,"Today, I’m announcing the next tranche of security assistance to Ukraine:

A $1.85 billion package that includes equipment and ammunition contracts. And a Patriot missile battery that we will train forces to operate as part of our efforts to strengthen Ukrainian air defense.",,74341,7323,25950
22,2022-12-12 19:00:03+00:00,POTUS,"I joined G7 Leaders and President Zelenskyy to discuss the progress we’ve made under Germany’s presidency to address pressing challenges of our time – Russia’s brutal war against Ukraine, climate, food and energy security, infrastructure, and more.
 
We're more united than ever. https://t.co/KdG4Iw2Ixl",https://pbs.twimg.com/media/FjzKFB4WAAgyyH8?format=jpg&name=large,14725,2196,3410
23,2022-12-05 17:51:23+00:00,POTUS,"As of today, the national average price of gas is $3.40 a gallon – the lowest since early February and lower than when Putin invaded Ukraine.",,54058,7003,25762
24,2022-11-30 15:00:00+00:00,POTUS,"Gas prices are down, domestic production is up, and we’ve rallied the world to release oil to address a gas price hike inflamed by Russia’s unprovoked war on Ukraine.
 
All while continuing to power our historic economic and jobs growth.",,24532,4846,19050
25,2022-11-29 20:57:49+00:00,POTUS,"Finding common ground is crucial to funding the government, COVID, and the war in Ukraine – and resolving the train strike.
 
That’s why this morning, @VP and I met with the top leaders in Congress to get things done for the American people. https://t.co/driKYAEEsv",https://pbs.twimg.com/media/FiwoXMxWAAASOK6?format=jpg&name=large,7958,1545,2698
26,2022-11-29 19:33:38+00:00,POTUS,"Our releases from the Strategic Petroleum Reserve – and my call for global partners to release reserves of their own – have helped gas prices drop below where they were prior to Putin’s invasion of Ukraine.
 
We're blunting Putin's price hike.",,16430,3304,20357
27,2022-11-16 05:04:11+00:00,POTUS,"We also reaffirmed our continued readiness to hold Russia accountable for its brazen attacks on Ukraine, even as the G20 meets to deal with the wider impacts of the war.
 
And we all express our condolences to the families of the victims in Poland and Ukraine.",,9457,1365,804
28,2022-11-15 00:30:00+00:00,POTUS,"This week’s travel has brought together the broadest possible coalition of partners to confront this moment of great global challenges — from global inflation, to the climate crisis, to Russia’s brutal war against Ukraine.",,18104,3120,2578
29,2022-10-25 13:25:01+00:00,POTUS,"Congratulations to Rishi Sunak on becoming Prime Minister of the United Kingdom.

Together, I look forward to enhancing our cooperation on issues critical to global security and prosperity, including continuing our strong support for Ukraine.",,23221,2907,2382
30,2022-10-20 14:45:01+00:00,POTUS,"I thank Prime Minister Liz Truss for her partnership on a range of issues including holding Russia accountable for its war against Ukraine.

We will continue our close cooperation with the U.K. government as we work together to meet the global challenges our nations face.",,13568,1828,2045
31,2022-10-11 14:55:01+00:00,POTUS,"This morning, I spoke with President Zelenskyy and G7 Leaders about our unwavering commitment to hold Russia accountable for its war and support Ukraine for as long as it takes. https://t.co/SzXLWyjjeq",https://pbs.twimg.com/media/Fey_bPOX0AAWszp?format=jpg&name=large,56138,7761,10602
32,2022-10-10 17:51:49+00:00,POTUS,"The U.S. condemns Russia's missile strikes today across Ukraine which injured and killed civilians and demonstrated once again the brutality of Putin’s illegal war.

These attacks only reinforce our commitment to stand with the people of Ukraine for as long as it takes.",,83714,13683,10919
33,2022-10-04 17:41:29+00:00,POTUS,We remain ready to impose severe costs on any entity that supports Russia’s purported annexation and will continue to rally the world behind Ukraine’s efforts to defend its democracy.,,16281,2216,1298
34,2022-10-04 17:41:28+00:00,POTUS,"Today I spoke with President Zelenskyy to underscore that the U.S. will never recognize Russia’s purported annexation of Ukrainian territory.

I reaffirmed my commitment to continue supporting Ukraine, including through today's new $625 million security assistance package. https://t.co/0ZP2uopn4n",https://pbs.twimg.com/media/FePiZDjWIAY_9VQ?format=jpg&name=large,57129,6699,9859
35,2022-09-21 21:56:15+00:00,POTUS,"Today I sat down with United Kingdom Prime Minister Liz Truss.

We spoke about the life of Her Majesty Queen Elizabeth II and a range of shared challenges including Russia’s war in Ukraine, challenges posed by China, and securing sustainable and affordable energy supplies. https://t.co/tr0dBRFeJ7",https://pbs.twimg.com/media/FdNgCj9X0AMGXTj?format=jpg&name=large,10787,1275,1288
36,2022-09-21 19:48:36+00:00,POTUS,"I joined UN Secretary-General @AntonioGuterres to reaffirm the partnership between the U.S. and the United Nations.
 
We discussed the threat of Russia's war in Ukraine to the UN Charter and global community and the need for swift action to address climate and food insecurity. https://t.co/Chmwsv9IeF",https://pbs.twimg.com/media/FdNC0uQWYAEbkI2?format=jpg&name=large,6966,1275,1000
37,2022-09-20 15:31:35+00:00,POTUS,"Folks, gas prices are now back to levels they were at in early March.

That means nearly all of the increases since the beginning of Russia’s war in Ukraine have been wiped out.",,81417,12623,18226
38,2022-09-06 16:13:00+00:00,POTUS,"Congratulations to Prime Minister Liz Truss.

I look forward to deepening the special relationship between our countries and working in close cooperation on global challenges, including continued support for Ukraine as it defends itself against Russian aggression.",,20506,2573,2375
39,2022-08-25 17:25:01+00:00,POTUS,"I spoke with President Zelenskyy to congratulate Ukraine as it marks its Independence Day.

I know it is a bittersweet anniversary, but I made it clear that the United States would continue to support Ukraine and its people as they fight to defend their sovereignty. https://t.co/9NiDBGej1Z",https://pbs.twimg.com/media/FbBfCREXkAAc0Tw?format=jpg&name=large,33728,3990,4511
40,2022-08-24 12:51:18+00:00,POTUS,"Today, I congratulate the people of Ukraine on their Independence Day. 
 
The Ukrainian people have inspired the world with their courage and dedication to freedom. We are committed to continuing to support them as they defend their sovereignty and their democracy.",,44614,7127,6096
41,2022-08-08 17:59:33+00:00,POTUS,"Today, the United States has authorized our biggest security assistance package to date for Ukraine.

This package will get additional ammunition, weapons, and equipment to Ukraine to help meet their critical security needs as they defend their country.",,32234,4318,14302
42,2022-08-04 15:51:54+00:00,POTUS,"Putin is still waging his war in Ukraine, putting pressure on global oil supply, and families can feel it.

But we stepped up to release one million barrels of oil a day from our Reserve, and rallied our global partners to release from theirs. Now, prices are on a record decline.",,27669,4464,7022
43,2022-08-03 16:29:19+00:00,POTUS,"This morning, I held a secure phone call with my national security team. 
 
We discussed a wide range of priorities, including the United States’ support of a free and open Indo-Pacific and our continued support for Ukraine in response to Putin’s war. https://t.co/1tVJCJHvJD",https://pbs.twimg.com/media/FZP_To7XEAMZdEn?format=jpg&name=large,13294,1797,3562
44,2022-07-19 22:20:02+00:00,POTUS,"First Lady of Ukraine Olena Zelenska embodies the same tenacity and resilience as the country she hails from.

It was an honor for Jill and me to welcome her to the White House this afternoon. https://t.co/X8liTFT8Yw",https://pbs.twimg.com/media/FYD_u4PXkAA9OI7?format=jpg&name=large,24936,3398,2654
45,2022-07-19 15:15:00+00:00,POTUS,"When Putin further invaded Ukraine and oil prices went up, the industry was quick to increase prices at the pump.

But now that oil is lower, Americans haven’t seen those savings.

I want lower prices to benefit consumers – not prop up profits.",,33073,5595,8346
46,2022-06-30 15:57:55+00:00,POTUS,"Earlier this year, the U.S. surged 20,000 additional U.S. forces to Europe to strengthen our NATO Alliance in response to Russia’s aggression against Ukraine and the changing security environment.

We’ll continue to adjust our posture to ensure the defense of our Allies:",,12458,1849,2436
47,2022-06-29 20:35:02+00:00,POTUS,"In a moment when Putin has shattered peace in Europe and attacked the very tenets of the rules-based order, the United States and our Allies are stepping up to support Ukraine and boost our defenses. 

We’re proving that NATO is more needed now than it ever has been. https://t.co/vGTgRHCgAZ",https://pbs.twimg.com/media/FWcn55EWAAQUDko?format=jpg&name=large,20325,3483,2830
48,2022-06-27 23:40:14+00:00,POTUS,"We could have turned a blind eye to Putin’s barbaric war against Ukraine and the price of gas wouldn’t have spiked the way it has, but America rose to the moment.

We proudly stand with Ukraine. https://t.co/zF2XfkJjp7",https://pbs.twimg.com/media/FWS_HUXWIAEvZs4.jpg,16198,2645,4882
49,2022-06-27 22:35:02+00:00,POTUS,"Together, the G7 will deliver unwavering, unified commitment to support Ukraine and build on our unprecedented sanctions to hold President Putin accountable – sanctions that will only compound over time to further isolate Russia from the world economy. https://t.co/EJlINtkEfm",https://pbs.twimg.com/media/FWSwMHtWYAQ9HMW?format=jpg&name=large,6967,1518,1393
50,2022-06-27 22:10:35+00:00,POTUS,"Russia's attack on civilians at a shopping mall is cruel. We stand in solidarity with the Ukrainian people.

As demonstrated at the G7 Summit, the U.S. along with our allies and partners will continue to hold Russia accountable for such atrocities and support Ukraine’s defense.",,29166,4613,3787
51,2022-06-26 17:10:47+00:00,POTUS,This morning I met with @Bundeskanzler Olaf Scholz to discuss our common objective of supporting Ukraine in the defense of its democracy against Russian aggression and a range of shared priorities the G7 will advance together. https://t.co/zRXXsc3Kgl,https://pbs.twimg.com/media/FWMcY3tWQAEzzBO?format=jpg&name=large,15151,1857,1996
52,2022-06-26 06:30:00+00:00,POTUS,"The United States has imposed unprecedented costs on Putin to deny him the revenue he needs to fund his war against Ukraine.

Together, the G7 will announce that we will ban the import of Russian gold, a major export that rakes in tens of billions of dollars for Russia.",,34320,5480,5643
53,2022-06-22 17:40:31+00:00,POTUS,"I’m doing everything I can to blunt the Putin Price Hike and bring down the cost of gas and food.

I led the world to coordinate the largest release from global oil reserves in history, and I’m working to get 20 million tons of grain out of Ukraine to help bring down prices.",,39687,6901,17728
54,2022-06-17 17:34:41+00:00,POTUS,"The Major Economies Forum met today at a moment when urgent energy issues demand our action.

Russia's brutal assault on Ukraine has fueled a global energy crisis, driving up inflation worldwide.

We must work together to tackle inflation and mitigate the fallout of this crisis.",,9729,2050,3188
55,2022-06-16 02:00:00+00:00,POTUS,"This morning, I spoke with President Zelenskyy to discuss Russia’s brutal and ongoing war against Ukraine. I reaffirmed our commitment to stand by Ukraine and shared that the United States is providing over $1.2 billion in additional security and humanitarian assistance.",,47440,6491,11907
56,2022-05-21 19:10:12+00:00,POTUS,"Today I signed the Additional Ukraine Supplemental Appropriations Act of 2022. This law will allow us to continue sending security, economic, and humanitarian assistance to the people of Ukraine as they continue to defend their democracy and freedom. https://t.co/kqICAxrski",https://pbs.twimg.com/amplify_video_thumb/1528090756157685760/img/Cq_0iQH8NAAFrgo5.jpg,14553,2584,4155
57,2022-05-20 16:31:20+00:00,POTUS,"We’ve seen just how critical it is. A global semiconductor shortage is contributing to higher prices around the world. And now, Putin’s brutal and unprovoked war on Ukraine has further spotlighted the need to secure our critical supply chains.",,5894,868,665
58,2022-05-19 19:19:39+00:00,POTUS,I applaud Congress for passing the security package I requested and for sending a clear bipartisan message to the world that the U.S. stands with Ukraine. This package will allow us to send even more weapons and ammunition to Ukraine as they defend their democracy and freedom.,,23255,3841,4667
59,2022-05-16 21:52:31+00:00,POTUS,"Today, I welcomed Greek Prime Minister Kyriakos Mitsotakis to the White House for a bilateral meeting. We reaffirmed our strong relationship, celebrated 201 years of Greek independence, and discussed our ongoing efforts to support Ukraine. https://t.co/NvX3H7W1li",https://pbs.twimg.com/media/FS6Tr3BWQAESXst?format=jpg&name=large,11040,1573,1171
60,2022-05-11 20:15:43+00:00,POTUS,"Today, I visited a family farm in Illinois to discuss how we’re investing in farmers, reducing food prices at home, and feeding a world in need. Putin’s war in Ukraine has cut off a critical source of food, but American farmers like Jeff are helping to fill the gap. https://t.co/n0kh7asHXq",https://pbs.twimg.com/media/FSgNkkiXEAI4Quv?format=jpg&name=large,8846,1537,1811
61,2022-05-10 14:55:26+00:00,POTUS,"This afternoon, I’m hosting a bilateral meeting with Prime Minister Mario Draghi of Italy at the White House. I look forward to reaffirming the friendship and strong partnership between our two nations and discussing our ongoing support for Ukraine.",,14507,1983,1960
62,2022-05-09 22:46:30+00:00,POTUS,"This afternoon, I signed the Ukraine Democracy Defense Lend-Lease Act of 2022 into law. This bill provides another important tool in our efforts to support Ukraine and its people in their fight to defend their country and democracy against Putin’s brutal war. https://t.co/7ojQj6Vt5C",https://pbs.twimg.com/media/FSWc6feXMAId1yL?format=jpg&name=large,23280,3931,3792
63,2022-05-08 17:30:32+00:00,POTUS,"Today, I spoke with G7 Leaders and President Zelenskyy about our ironclad unity and commitment to keep strengthening Ukraine and ratcheting up the pain on Putin. https://t.co/15FYYnfueS",https://pbs.twimg.com/media/FSQLAN9XwAM_KcE?format=jpg&name=large,29711,4375,4454
64,2022-05-06 21:00:53+00:00,POTUS,"Today, the U.S. is continuing our strong support for the brave people of Ukraine as they defend their country. I am announcing another package of security assistance that will provide additional artillery munitions, radars, and other equipment to Ukraine. https://t.co/lpvJbFF9Q3",,5939,1193,1468
65,2022-05-05 20:30:23+00:00,POTUS,"This week, I visited a Javelin missile factory in Alabama to thank them for all they’re doing to support Ukraine. https://t.co/aEsgMe2fb6",https://pbs.twimg.com/amplify_video_thumb/1522312688197644288/img/PQ8zS7kwfnUQPqgz.jpg,10385,1557,1287
66,2022-05-03 23:15:05+00:00,POTUS,"Today, I visited a Lockheed Martin factory in Alabama that’s building the Javelin missiles we’re sending to Ukraine. The weapons built here — now in the hands of Ukrainian heroes — are making all the difference. That’s something we can all be proud of. https://t.co/35hTvlDGSE",https://pbs.twimg.com/media/FR3p5xSXMAEXNIy?format=jpg&name=large,17405,2734,3233
67,2022-05-03 20:26:49+00:00,POTUS,"Since Russia attacked Ukraine just over two months ago, we have sent more than $3 billion in security assistance to Ukraine. 

That money is a direct investment in defending freedom and democracy itself.",,38102,4630,9499
68,2022-05-03 19:02:09+00:00,POTUS,Tune in as I deliver remarks on the security assistance we are providing to Ukraine. https://t.co/8bYpepTp4t,,4221,855,991
69,2022-04-30 19:00:22+00:00,POTUS,"As we continue to deliver critical support to Ukraine, we must also not let our guard down in the fight against COVID-19 at home and abroad. https://t.co/FfQSLimxof",https://pbs.twimg.com/media/FRnS2KgXEAUp-Cn.jpg,12167,2064,4075
70,2022-04-30 17:03:01+00:00,POTUS,"I’ve always had respect for the press, but I can’t say enough about how much respect I have after their reporting in Ukraine. They’re risking their lives every single day to make sure the world hears the truth. https://t.co/ckRcEk3Q5D",https://pbs.twimg.com/amplify_video_thumb/1520448578858229760/img/3cp391l4BesjSZKv.jpg,30466,5296,3406
71,2022-04-28 19:21:31+00:00,POTUS,"In order to sustain Ukraine as it continues this fight, I am sending to Congress a supplemental budget request.

It will keep weapons and ammunition flowing to the brave Ukrainian fighters and continue delivering economic and humanitarian assistance to the Ukrainian people. https://t.co/kDd39QY539",https://pbs.twimg.com/media/FRdEgjbX0AgIpKX?format=jpg&name=large,15399,2350,2379
72,2022-04-28 18:15:31+00:00,POTUS,"Russia’s assault has yielded immense human costs. We’ve seen them leave behind horrifying evidence of their atrocities and war crimes in the areas they tried to control.

In the face of these atrocities, we will continue to supply military assistance to Ukraine.",,16563,2736,1895
73,2022-04-28 17:37:04+00:00,POTUS,"Despite the disturbing rhetoric coming out of the Kremlin, the facts are plain for all to see: We are not attacking Russia. We are helping Ukraine defend itself against Russian aggression. And just as Putin chose to launch this brutal invasion, he could make the choice to end it.",,63377,10564,3951
74,2022-04-28 15:52:41+00:00,POTUS,"I just signed a request to Congress for critical security, economic, and humanitarian assistance to help Ukraine continue to counter Putin’s aggression at a pivotal moment.

We need this bill to support Ukraine in its fight for freedom.",,34377,5146,8583
75,2022-04-24 22:50:52+00:00,POTUS,"Congratulations to @EmmanuelMacron on his re-election. France is our oldest ally and a key partner in addressing global challenges. I look forward to our continued close cooperation — including on supporting Ukraine, defending democracy, and countering climate change.",,139559,16518,6006
76,2022-04-24 18:11:41+00:00,POTUS,"Two months after Putin launched an unprovoked and unjustified attack on Ukraine, Kyiv still stands. President Zelenskyy and his democratically-elected government remain in power.
 
We will continue to support Ukrainians in their fight to defend their homeland.",,88015,12579,6984
77,2022-04-22 15:11:01+00:00,POTUS,"Yesterday, I announced additional support for Ukraine in the face of Russian aggression. https://t.co/ty8cAWK9xT",https://pbs.twimg.com/amplify_video_thumb/1517521284959293441/img/M8cm7ltI5LZyliHq.jpg,12289,1948,2448
78,2022-04-21 23:45:00+00:00,POTUS,"As Russia continues to grind out brutalities against Ukraine, Putin is banking on us losing interest. He is betting that Western unity will crack.
 
Once again, we will prove him wrong.",,42616,6896,3912
79,2022-04-21 23:15:00+00:00,POTUS,"Every American taxpayer, every member of our Armed Forces can be proud of the fact that our country’s generosity — and the skill and service of our troops — helped arm Ukraine to repel Russia’s aggression.",,7819,974,628
80,2022-04-21 23:15:00+00:00,POTUS,The sustained and coordinated support of the international community — led and facilitated by the United States — is a significant reason why Ukraine has been able to stop Russia from taking over their country.,,15350,2240,1096
