id,Date,User,Tweet,Media,Likes,Retweets,Comments
166,2022-03-24 20:00:48+00:00,BarackObama,"Today @POTUS announced that the U.S. will be welcoming 100,000 refugees fleeing the war in Ukraine.
 
This is the right thing to do.
 
If you're looking for ways to help, join @WelcomeUS and support the refugees who will be arriving here soon: https://t.co/tXJCE3tiCE",,15326,2538,1516
167,2022-03-16 19:30:35+00:00,BarackObama,"As we bear witness to the tragedy unfolding in Ukraine, here are three articles worth reading. First, a description of the scale of the Ukrainian refugee crisis, underscoring the need for all of us to support relief efforts. https://t.co/uwuz2VqpC7",,11261,2384,787
168,2022-03-10 23:17:37+00:00,BarackObama,".@Airbnb is offering free, short-term housing for 100,000 refugees fleeing Ukraine. https://t.co/iBLlGM8Pgj",,16428,2382,445
169,2022-03-10 23:17:36+00:00,BarackObama,"Over the last few weeks, we’ve seen people, organizations, and companies around the world stepping up to support the people of Ukraine. Here are some examples I’ve been tracking:",,61052,9470,1973
170,2022-02-24 20:36:34+00:00,BarackObama,"Last night, Russia launched a brazen attack on the people of Ukraine, in violation of international law and basic principles of human decency. Here’s my statement on what it means, and what should happen next. https://t.co/Wa0C8XGwvK",https://pbs.twimg.com/media/FMY5ND6XIAIVmkd?format=jpg&name=large,184542,30947,10946
171,2022-03-10 21:30:02+00:00,KamalaHarris,"I’m in Poland to affirm our commitment to Poland and our NATO allies. 

We are prepared to defend all of the principles that are integral to us as NATO countries, in this case standing up for the sovereignty and territorial integrity of Ukraine.",,8914,1097,863
172,2022-03-07 21:52:00+00:00,KamalaHarris,"The eyes of the world are on the brave people of Ukraine. 

They're fighting not just to defend their homes and families, but to defend their democracy, freedom, sovereignty, and territorial integrity. And we stand with them.",,11336,1369,1148
173,2023-01-09 16:44:15+00:00,HillaryClinton,"Simply love this @GMA story following @aliceminsoochun as she brings light to children in Ukraine coping with rolling blackouts because of Putin's war. 

Chelsea and I loved learning about her work on @solightdesign as part of @appletvplus's #Gutsy. https://t.co/dnml0asqcc",,1339,292,0
174,2022-11-28 18:12:01+00:00,HillaryClinton,".@peoplelikeuspod, the new podcast from @kimghattas, brings together people from the Middle East and beyond to connect dots across borders. 

Listen for smart conversations on issues that matter to all of us, from abortion rights to Ukraine and poetry. https://t.co/OdiM1o5XNN",,598,159,0
175,2022-05-09 16:30:35+00:00,HillaryClinton,"The First Lady's visit to Ukraine this weekend was an important gesture of solidarity with Ukrainian families. As Putin's war goes on, our hearts are with everyone separated from their loved ones and raising kids amid conflict, one day at a time.",,4944,608,249
176,2022-04-29 13:14:19+00:00,HillaryClinton,"Here’s an incredible opportunity to help people fleeing Ukraine: 

@POTUS has announced a path for 100,000 people to get refuge in the US, but they need a US citizen or permanent resident to be their sponsor. That could be you. 

Learn more via @WelcomeUS: https://t.co/Vy1R3LWnof https://t.co/toDesEz7XP",https://pbs.twimg.com/media/FRg59-yWYAU8QAH?format=png&name=large,2042,800,628
177,2022-04-28 18:07:06+00:00,HillaryClinton,".@Madeleine knew better than most that yes, it can happen here—and time is of the essence. 

We must heed the wisdom of her life and the cause of her public service and stand up to dictators and demagogues—from Ukraine to the halls of our own capital. 

https://t.co/cHRU9eTn2p https://t.co/9gXSW9NDcQ",https://pbs.twimg.com/media/FRczY4TXwAAP40s?format=jpg&name=large,3568,632,290
178,2022-04-04 15:38:12+00:00,HillaryClinton,The only way we're going to end the bloodshed and terror Putin has unleashed in Ukraine—and the only way we're going to protect Europe and democracy—is to do everything we can to impose even greater costs on Putin. https://t.co/3TnvTyui6A,https://pbs.twimg.com/media/FPbF59gXwAE54Yk.jpg,7013,1416,794
179,2022-04-01 16:49:31+00:00,HillaryClinton,"Putin’s invasion of Ukraine underscores the need to fight autocracy and defend free, democratic societies. 

The Hungarian elections on April 3 are an opportunity to reaffirm democracy. 

Hungarians in Hungary, the U.S., and elsewhere: Go vote!",,8362,1833,995
180,2022-03-30 14:39:17+00:00,HillaryClinton,"As Putin bombs civilians in Ukraine and the world condemns him as a war criminal, Trump is… once again asking him for help besting his political opponents.

What is wrong with him?

https://t.co/LcflscsBWr",,24571,5592,5219
181,2022-03-25 14:07:06+00:00,HillaryClinton,"I spoke to @anneapplebaum about a lesson we should learn from Putin's unprovoked attack on Ukraine: we cannot take democracy for granted. 

Find our full conversation on this week's You And Me Both, available wherever you get your podcasts. https://t.co/MrtAmZSHLc https://t.co/hvW5oADv6l",https://pbs.twimg.com/ext_tw_video_thumb/1507358166425743399/pu/img/2jJWNey02sBepd5G.jpg,1542,386,259
182,2022-03-22 17:43:38+00:00,HillaryClinton,"After weeks of horror, what happens next in Russia’s unprovoked war on Ukraine? 

Join me as I talk to two experts—@McFaul and @AnneApplebaum—about what drives Putin, what the US can do to help Ukraine, and how to fight Russia's crackdown on truth. 

https://t.co/MrtAmZSHLc https://t.co/xvQDQ21JIv",https://pbs.twimg.com/media/FOeLOC-WYAYg-JD?format=jpg&name=large,2690,636,806
183,2022-03-01 14:48:45+00:00,HillaryClinton,"I talked to @maddow about Russia, Ukraine, and how all this might end.",,8473,1671,1038
184,2022-02-24 13:27:03+00:00,HillaryClinton,"I am praying for the people of Ukraine. 

The world will hold Russia and Putin accountable for the human suffering and destruction this unjustified and unprovoked war will bring.",,56553,6949,5352
185,2022-09-20 14:42:30+00:00,BillClinton,I’m honored to talk with President @ZelenskyyUa at @ClintonGlobal to discuss how best to support the people of Ukraine in their quest for freedom. Tune in live:,,1271,262,311
186,2022-08-09 22:15:17+00:00,BillClinton,I’m deeply concerned of reports of military activity in and around the Zaporizhzhia nuclear plant in Ukraine. The recklessness of these attacks endangers the people and risks instability in the region. IAEA inspectors need access to the plant in order to avoid a real calamity.,,1193,257,140
187,2022-04-22 21:15:54+00:00,BillClinton,"If you have watched the horrors in Ukraine and wondered what you can do, @WelcomeUS, supported by @GoldmanSachs, is mobilizing 100k Americans to #beawelcomer to Ukrainians seeking refuge here. More here: https://t.co/1TtWdbDtyh",,561,164,162
188,2022-03-24 16:57:39+00:00,BillClinton,"Millions have fled violence in Ukraine, and some will find a home in the US. I know many Americans are ready to help, and @WelcomeUS has ways for you to do just that. Learn more: https://t.co/1TtWdbDtyh",,963,253,147
189,2022-03-18 21:25:29+00:00,BillClinton,America stands united with the people of Ukraine in their fight for freedom and against oppression. https://t.co/O7INc9S1tq,https://pbs.twimg.com/ext_tw_video_thumb/1504931818658803717/pu/img/_-dvP-OgOfik20GE.jpg,80536,13668,4274
190,2022-03-16 15:41:43+00:00,BillClinton,This is an interesting and important read + watch for anyone who wants to understand what's happening in Ukraine. https://t.co/j5Fpbpr2M9,,2126,642,229
191,2022-03-04 23:00:30+00:00,BillClinton,"Thank you to the incredible people and organizations helping those in need in Ukraine. If you’re able, I hope you’ll consider supporting their important work.",,1100,208,200
192,2022-02-24 18:28:44+00:00,BillClinton,My statement on Russia's unprovoked and unjustified invasion of Ukraine. https://t.co/h7tfLhxRqe,https://pbs.twimg.com/media/FMYcQ2kXsAEm5ni?format=jpg&name=large,10675,1475,670
193,2022-04-08 21:54:12+00:00,BernieSanders,"In the midst of the pandemic, the war in Ukraine, massive income and wealth inequality and the attacks on democracy, we cannot forget about the existential threat to our planet from climate change. The recent IPCC report was clear. We have to act boldly – and NOW.",,4570,785,309
194,2022-03-25 19:00:24+00:00,BernieSanders,There must be no ambiguity in acknowledging that what the whole world is seeing from Vladimir Putin’s war in Ukraine is nothing less than a blatant violation of international law and human decency. https://t.co/RokWTb6LzZ,https://pbs.twimg.com/media/FOtivr7XoAMqkEd.jpg,1187,250,204
195,2022-03-24 00:35:18+00:00,BernieSanders,"LIVE: What should the progressive response be to Russia’s war on Ukraine? Join @BLeeForCongress, @brhodes, @PeterBeinart and @MariaRepnikova as we discuss that question and more. 

https://t.co/a8QOWzG5US",,389,108,73
196,2022-03-24 00:05:12+00:00,BernieSanders,"LIVE: I’m with @BLeeforCongress, @PeterBeinart, @brhodes and @MariaRepnikova to discuss how we respond to Russia’s horrific war on Ukraine. Join us. https://t.co/a8QOWzGDKq",,477,137,43
197,2022-03-22 00:00:00+00:00,BernieSanders,"Join me and special guests @BLeeForCongress, @PeterBeinart and @brhodes this Wednesday at 8 PM ET for a town hall discussion about the progressive response on foreign policy and the war in Ukraine. https://t.co/P6y599D7fM",https://pbs.twimg.com/media/FOaVSMwXsAgXRcb?format=jpg&name=large,700,163,86
198,2022-03-07 20:14:05+00:00,BernieSanders,"In the midst of Putin's horrific invasion of Ukraine, I want to express my solidarity with the many thousands of Russians who are out on the streets protesting the war. In an authoritarian society, they are risking their freedom and lives. They are showing incredible courage.",,19554,2402,416
199,2022-03-01 21:43:15+00:00,BernieSanders,"None of these oligarchs should be allowed to park their yachts, fly their jets, sleep in their mansions, or stash their cash offshore during the war in Ukraine. But much more must be done to stop the movement to oligarchy not just in Russia, but all over the world. (13/14)",,9363,1477,124
200,2022-03-01 21:43:13+00:00,BernieSanders,"While people in Ukraine and Russia suffer, Putin owns a 270-foot long super yacht that he took out of Germany before the invasion of Ukraine. Putin’s yacht is equipped with a gym, a saloon, a spa, a library &amp; a 49-foot indoor pool that can be converted into a dance floor. (6/14)",,5296,800,66
201,2022-03-01 21:43:11+00:00,BernieSanders,"Putin is not only an autocrat who initiated an illegal &amp; immoral war against Ukraine, he's the leader of an oligarchic kleptocracy that's stolen billions from the Russian people. In Russia, ordinary people struggle while Oligarchs make out like bandits – which they are. (1/14)",,36082,8018,1234
202,2022-02-24 20:47:15+00:00,BernieSanders,"Putin, a multi-billionaire, is the poster boy for greed and oligarchy. Maybe, before starting a war that could kill thousands and displace millions, he might worry more about the people of Ukraine and Russia and less about his precious super-yacht. https://t.co/fVb5SjFXm5",,17659,3156,1465
203,2023-02-01 19:24:31+00:00,SpeakerPelosi,"Yesterday, it was my privilege to meet with @AndriyKostinUA.

I commended him for holding Russian officials accountable for war crimes and aggression against civilians — especially against women and girls.

Ukraine continues to advance the cause of justice around the world. https://t.co/cuXJ5lgIZz",https://pbs.twimg.com/media/Fn54sErWYAEyFky?format=jpg&name=large,1682,257,285
204,2023-01-25 19:45:12+00:00,SpeakerPelosi,"Thank you @POTUS for your leadership working with other nations to support the Ukrainian people as they fight back against Russian aggression.

Abrams tanks and additional weaponry reaffirm America's commitment to stand with Ukraine until the victory of democracy over autocracy.",,9704,1424,2973
205,2022-12-23 23:19:50+00:00,SpeakerPelosi,"Through tenacious negotiating, @HouseDemocrats secured consequential aid for Ukraine, reforms to the Electoral Count Act and key victories for families across the country.  

Now, we proudly send this vital legislation to @POTUS’ desk.",,4100,523,825
206,2022-12-22 00:11:13+00:00,SpeakerPelosi,"Join live as @ZelenskyyUa delivers an inspiring message of unity, resilience and determination tonight in an Address to a Joint Meeting of Congress. 
 
The fight for Ukraine is the fight for democracy itself.   https://t.co/3o6Otqhdrf",,11108,1606,1077
207,2022-12-22 00:07:57+00:00,SpeakerPelosi,It is my distinct privilege to welcome President @ZelenskyyUa to the United States Capitol and reaffirm America’s commitment: we will stand with Ukraine in the fight for freedom until the war is won. https://t.co/nQYARAk8iD,https://pbs.twimg.com/media/FkimmujXEAAdE6a?format=jpg&name=large,53123,5870,5004
208,2022-12-21 23:14:43+00:00,SpeakerPelosi,"Join His Excellency @ZelenskyyUa, President of Ukraine and me at the United States Capitol ahead of his address to a Joint Meeting of Congress. https://t.co/pdiEHGwKjP",,6962,840,820
209,2022-12-20 17:06:26+00:00,SpeakerPelosi,"The omnibus includes a huge increase in veterans’ health care — including for implementing our PACT Act. The bill will also increase pay for our troops and meet military families’ needs.

This legislation also delivers further aid to Ukraine, supporting their fight for Democracy.",,739,113,53
210,2022-12-08 15:35:13+00:00,SpeakerPelosi,"For nearly 10 months, Brittney Griner suffered unthinkable trauma as she was wrongfully imprisoned by Russia. Putin’s cruelty against Brittney – and his monstrous actions against Ukraine – are reminders of his brazen contempt for human rights, human dignity and the rule of law.",,1816,276,664
211,2022-12-05 21:19:26+00:00,SpeakerPelosi,"It was an honor to meet with the Honorable @SanduMaiaMD, President of the Republic of Moldova today.
 
We discussed the war in Ukraine, Russia's continued aggression, and the imperative to protect democracy and ensure regional energy independence and security. https://t.co/yGHpxbhrco",https://pbs.twimg.com/media/FjPmsY5XoAA6Hlm?format=jpg&name=large,6401,791,976
212,2022-10-27 22:08:18+00:00,SpeakerPelosi,"This week, I was proud to represent the Congress at the First Parliamentary Summit of the International @CrimeaPlatform to reiterate our commitment to stand with Ukraine until victory is won. https://t.co/PfJ3uo13sq",https://pbs.twimg.com/media/FgG77RUWQAEervn.jpg,2538,520,1924
213,2022-10-25 16:19:12+00:00,SpeakerPelosi,"Congressman @GerryConnolly and I return to Washington further informed about Ukraine’s security, economic and humanitarian needs, as the Congress prepares to deliver another round of assistance to Ukraine in the upcoming omnibus legislation. https://t.co/vFUIdUvBgh",,504,103,112
214,2022-10-25 16:19:10+00:00,SpeakerPelosi,"The remarks by Congressman @GerryConnolly, President of the NATO Parliamentary Assembly, on the central role of our transatlantic alliance in supporting Ukraine’s fight for freedom and countering Russian aggression were an especially valuable contribution to the conversation. https://t.co/U4uHPYVxXi",https://pbs.twimg.com/media/Ff7Y8ZEWQAAEmmJ?format=jpg&name=large,336,66,18
215,2022-10-25 16:19:08+00:00,SpeakerPelosi,"At the gracious invitation of the distinguished Speaker @R_Stefanchuk of Ukraine, I had the extraordinary honor of addressing the Plenary Session this morning. On behalf of the United States, my remarks reaffirmed our nation’s pledge to stand with Ukraine until victory is won.",,278,58,14
216,2022-10-25 16:19:07+00:00,SpeakerPelosi,"Today, at the First Parliamentary Summit of the International Crimea Platform, America and our allies sent an unmistakable statement to Putin: the free world is united in our unshakeable support for the people of Ukraine. https://t.co/oJF3FnUS2l",https://pbs.twimg.com/media/Ff7Y7vVWYAAjSDJ?format=jpg&name=large,2885,675,505
217,2022-10-25 14:26:45+00:00,SpeakerPelosi,"The international community’s solidarity has been vital to Ukraine’s fight – and it will be even more so, as winter approaches.
 
As I said to my colleagues at the Summit: let us all have the courage of the Ukrainian people as we ensure that the flame of liberty burns bright. https://t.co/1lIkq1zSUr",https://pbs.twimg.com/media/Ff6_Nk3XgAAzQLT?format=jpg&name=large,535,88,61
218,2022-10-25 14:26:43+00:00,SpeakerPelosi,"Under President Biden, America has delivered on our promise to support the Ukrainian people: securing critical assistance and holding Russia accountable.

We have acted on a bipartisan basis – because what is at stake in Ukraine is Democracy itself. https://t.co/dN8e3ZBWgt",https://pbs.twimg.com/media/Ff6_NHPWQAA_K79?format=jpg&name=large,392,57,38
219,2022-10-25 14:26:41+00:00,SpeakerPelosi,"Today, it was my high honor to address the First Parliamentary Summit of @CrimeaPlatform, at the invitation of Speaker @R_Stefanchuk.

My message was simple: America and our allies pledged to stand with Ukraine until victory is won – and that is what we will do. https://t.co/VbPwNBXsf5",https://pbs.twimg.com/media/Ff6_Ms7XEAIMLnz?format=jpg&name=large,1285,288,217
220,2022-10-25 08:12:11+00:00,SpeakerPelosi,"Join me in Zagreb, Croatia at the First Parliamentary Summit of @CrimeaPlatform to convey a statement of America’s fierce commitment to Ukraine’s fight for freedom.

Today, we are affirming that we will be with the Ukrainian people until victory is won. https://t.co/bcvuGkw9bV",,791,218,181
221,2022-10-25 08:02:43+00:00,SpeakerPelosi,"It’s my honor to represent the United States at the First Parliamentary Summit of the International @CrimeaPlatform.

In Zagreb, our European allies and global partners have gathered to send an unmistakable message: the free world is united in our unbreakable support for Ukraine. https://t.co/xtxM0TUjKW",https://pbs.twimg.com/media/Ff5l9zkXkAIE3uH?format=jpg&name=large,1585,350,232
222,2022-10-25 00:25:45+00:00,SpeakerPelosi,"As Putin escalates his appalling atrocities against civilians, we reaffirm this truth: Crimea is Ukraine, Russia’s unlawful occupation of all Ukrainian territory must end, and Russia must be held accountable for its crimes. Read my full statement here: https://t.co/kvODupI1h9",,904,226,80
223,2022-10-25 00:25:45+00:00,SpeakerPelosi,"It was my privilege to meet with human rights activists from Crimea, who shared their harrowing &amp; heartbreaking stories of torture, imprisonment &amp; abductions at Russia’s hands. We must strengthen Ukraine’s capacity in this fight, as Iranian drones take a deadly toll on civilians.",,1417,321,130
224,2022-10-25 00:25:44+00:00,SpeakerPelosi,"It was an honor to meet with PM @AndrejPlenkovic and Speaker Gordan Jandroković. Croatia is a valued American ally and a key partner in peace and stability in Europe, including in energy, security and our global response to Russia’s aggression against Ukraine.",,558,105,11
225,2022-10-25 00:25:41+00:00,SpeakerPelosi,"Today, thanks to @ZelenskyyUa &amp; @R_Stefanchuk, it was a privilege to attend the First Parliamentary Summit of the International @CrimeaPlatform in Croatia. It is a tribute to the broad &amp; urgent global support for Ukraine that more than 50 nations are participating in this summit. https://t.co/agX8lGBacJ",https://pbs.twimg.com/media/Ff3-tRCWIAEG8wh?format=jpg&name=large,2522,540,323
226,2022-10-24 22:43:22+00:00,SpeakerPelosi,"It was an honor to meet with Ukrainian Speaker @R_Stefanchuk &amp; express America’s admiration for the heroes of Ukraine. We reaffirmed that America &amp; our allies stand with the Ukrainian people – in Crimea, in other illegally annexed areas, across the country – until victory is won. https://t.co/hHjmW2j455",https://pbs.twimg.com/media/Ff3nQXZXkAIxQ-m?format=jpg&name=large,2207,370,444
227,2022-10-24 19:16:42+00:00,SpeakerPelosi,"The U.S.-German alliance is central to supporting Ukraine, as well as advancing global peace, security and stability.

Meeting with Bundestag President @BaerbelBas, I thanked her for hosting the G7 Speakers’ Meeting last month and discussed our ongoing work to defend democracy. https://t.co/0b5TxImKLL",https://pbs.twimg.com/media/Ff23-pdXoAI1KVi?format=jpg&name=large,757,150,202
228,2022-10-24 19:12:11+00:00,SpeakerPelosi,"Today, I met with Croatian Prime Minister @AndrejPlenkovic &amp; Foreign Minister @GrlicRadman: top officials of a valued U.S. ally &amp; key regional leader.

We discussed how our nations can continue advancing security &amp; stability in Europe, especially through our support for Ukraine. https://t.co/I7MZimNea2",https://pbs.twimg.com/media/Ff224IUWAAMnUKG?format=jpg&name=large,821,136,173
229,2022-10-24 18:19:25+00:00,SpeakerPelosi,"It was a privilege to meet with Speaker of the Croatian Parliament Gordan Jandroković, whose government is hosting the First Parliamentary Summit of the International Crimea Platform.

In our meeting, we reaffirmed our shared commitment to stand with Ukraine until victory is won. https://t.co/3Tru0fNwlT",https://pbs.twimg.com/media/Ff2qzaWWQAEgNDx?format=jpg&name=large,969,187,246
230,2022-10-24 13:45:17+00:00,SpeakerPelosi,"Join Speaker Gordan Jandroković and me in Zagreb, Croatia for remarks on the important relationship between the U.S. and Croatia, the First Parliamentary Summit of the International Crimea Platform and our shared commitment to Ukraine. https://t.co/37Y3F8QNiA",,708,161,176
231,2022-10-23 22:43:38+00:00,SpeakerPelosi,"NATO Parliamentary Assembly President Congressman @GerryConnolly and I look forward to discussing how we can further support the people of Ukraine as they defend Democracy – for their nation and for the world.
https://t.co/escG94oGLz",,803,192,133
232,2022-10-23 22:43:37+00:00,SpeakerPelosi,"Working with speed, strength and unity, America and our allies have imposed devastating consequences on Russia and delivered game-changing aid to Ukraine. Our ironclad solidarity with the heroes of Ukraine has been decisive, and it will be even more crucial as winter approaches.",,805,189,54
233,2022-10-23 22:43:33+00:00,SpeakerPelosi,"Russia is waging an unprovoked, all-out assault on Ukraine: from the occupation of Crimea to attempts to illegally annex additional Ukrainian territory to escalating targeting of civilians. That's why America &amp; our allies are reaffirming our pledge to support the Ukrainian people",,993,245,89
234,2022-10-23 22:42:59+00:00,SpeakerPelosi,"As Speaker, it’s my privilege to represent the United States at the First Parliamentary Summit of the International Crimea Platform.

Alongside European allies and global partners, we will deliver an unmistakable statement of our solidarity with Ukraine in its fight for freedom.",,5703,1343,1577
235,2022-09-30 19:52:20+00:00,SpeakerPelosi,"We continue to look to his leadership for guidance today as we defend democracy against autocracy, especially in Ukraine.

This magnificent statue will serve as a constant symbol of our commitment to democracy. https://t.co/qH44fg3Yvs",https://pbs.twimg.com/media/Fd7Z8nuWAAEAM_F?format=jpg&name=large,688,91,165
236,2022-09-20 00:55:38+00:00,SpeakerPelosi,"This evening, I was honored to welcome His Excellency, Prime Minister @jonasgahrstore of Norway to the United States Capitol.
 
We discussed the importance of Finland and Sweden joining NATO, as well as Russia’s ongoing, unlawful invasion of Ukraine. https://t.co/czma7vcBHc",https://pbs.twimg.com/media/FdD16xtXwAMN5L-?format=jpg&name=large,1970,260,299
237,2022-09-17 13:56:18+00:00,SpeakerPelosi,"It is the moral duty of all to never forget: an obligation that has taken on heightened urgency as atrocities are perpetrated around the globe, including by Russia against Ukraine.",,2035,269,77
238,2022-09-16 18:00:38+00:00,SpeakerPelosi,"We discussed how our nations can continue our close collaboration, together with our G7 and European partners, to ensure that Ukraine is victorious, while protecting energy security and the financial security of families on both sides of the Atlantic in the face of Putin’s war. https://t.co/Mx4NJWDPIx",https://pbs.twimg.com/media/Fcy6EXNWQAMGYsS?format=jpg&name=large,613,68,57
239,2022-09-16 18:00:38+00:00,SpeakerPelosi,"At the @G7, it was an honor to meet with Chancellor @OlafScholz, a steadfast partner for peace and stability during this challenging moment for Democracy. 

His committed leadership to support Ukraine with security and humanitarian support and punish Russia has been essential. https://t.co/mmg5Dwf25b",https://pbs.twimg.com/media/Fcy6AOZX0AQZG7K?format=jpg&name=large,1540,193,156
240,2022-09-16 16:22:20+00:00,SpeakerPelosi,"The fight for freedom in Ukraine makes crystal clear the fragility — and the importance — of Democracy.

Today, at the @G7 Speakers' Summit, we discussed the role of civic education and engagement to bolster Democracy, here at home and around the world. https://t.co/6waw3vtKUF",https://pbs.twimg.com/media/FcyjcClXgAMn35F?format=jpg&name=large,1271,230,165
241,2022-09-16 12:48:46+00:00,SpeakerPelosi,"History teaches us that a threat to freedom anywhere is a threat to freedom everywhere.

G7 nations &amp; our allies will continue to support Ukraine’s righteous fight &amp; defend Democracy around the world.

And we do so, stronger &amp; more united than ever before. https://t.co/ZC4xBD8ghm",,1050,152,66
